{
  "$schema": "https://json-schema.org/draft/2020-12/schema",
  "$id": "https://lusora.dev/schemas/style_pack.schema.json",
  "title": "StylePack",
  "description": "Behavior document, consumed by the PLANNER and the COMPILER. Pacing numbers are constraints, not advice.",
  "type": "object",
  "required": [
    "name",
    "pacing",
    "overlays",
    "transitions"
  ],
  "additionalProperties": false,
  "properties": {
    "name": {
      "type": "string",
      "minLength": 1
    },
    "video_type": {
      "enum": [
        "doc",
        "explainer",
        "breakdown",
        "listicle"
      ],
      "description": "the video-type preset this pack implements; a channel's video_type picks among packs. Same enum as channel_config.video_type"
    },
    "pacing": {
      "type": "object",
      "required": [
        "avg_hold_seconds",
        "min_hold",
        "max_hold"
      ],
      "additionalProperties": false,
      "properties": {
        "avg_hold_seconds": {
          "type": "number",
          "exclusiveMinimum": 0
        },
        "min_hold": {
          "type": "number",
          "exclusiveMinimum": 0
        },
        "max_hold": {
          "type": "number",
          "exclusiveMinimum": 0
        },
        "arc": {
          "enum": [
            "three_act",
            "linear",
            "listicle"
          ],
          "default": "linear"
        },
        "hold_floor_ratio": {
          "type": "number",
          "minimum": 0,
          "default": 0,
          "description": "post-alignment per-beat FLOOR, as a multiple of min_hold. Narration beat durations are emergent from SRT alignment and never checked, so a beat can land at 0.8s and flash by; the compiler merges any visual slot below min_hold * this into its neighbour. 0 disables the pass \u2014 the schema default, so a video enqueued before this field existed re-runs byte-identically (Principle 7). The shipped packs set 1.0."
        },
        "hold_ceiling_ratio": {
          "type": "number",
          "minimum": 0,
          "default": 0,
          "description": "post-alignment per-beat CEILING, as a multiple of max_hold. A slot holding one long sentence has no boundary to cut at and sits there dead; the compiler divides anything above max_hold * this into equal slots. 0 disables the pass (see hold_floor_ratio). The shipped packs set 1.5."
        },
        "hook": {
          "type": "object",
          "additionalProperties": false,
          "description": "D106 — the opening hook, from the start of the narration to subjects.json hook_end_cut (a pipeline without the subjects stage has no hook to pace). Dark Palace's hook: faster cuts on word onsets, opening on footage, closing on the video's title with a riser into a hit. Off unless enabled, so a pack that does not set it compiles exactly as before.",
          "properties": {
            "enabled": { "type": "boolean", "default": false },
            "mode": {
              "enum": ["classic", "headlines"],
              "default": "classic",
              "description": "D107 — Dark Palace's hook option. classic = footage and the pack's own overlays; headlines = the hook_plan stage also puts 2-5 moments of the hook on screen in varied forms (a headline in big type, one giant word, a marked phrase of the narration, two number cards), each landing on words the narration says and never showing a number it does not."
            },
            "cut_s": { "type": "number", "minimum": 1, "maximum": 6, "default": 2.2, "description": "target seconds per hook shot; each cut moves to the nearest word onset" },
            "min_hold": { "type": "number", "minimum": 0.5, "default": 1.5, "description": "the hook's own hold floor, in place of pacing.min_hold x hold_floor_ratio" },
            "max_share": { "type": "number", "minimum": 0.05, "maximum": 0.5, "default": 0.25, "description": "the hook never runs longer than this share of the narration: a later hook_end_cut is pulled back to the last cut that fits" },
            "open_on": { "enum": ["footage", "any"], "default": "footage", "description": "footage = no graphic covers the first shot, and that shot is video rather than a still" },
            "title_card": {
              "type": "object",
              "additionalProperties": false,
              "properties": {
                "enabled": { "type": "boolean", "default": true },
                "component": { "type": "string", "default": "KineticTitle", "description": "catalog component whose `text` prop takes the video's title" },
                "seconds": { "type": "number", "minimum": 1, "default": 2.5 },
                "lead_cue": { "type": ["string", "null"], "default": "riser", "description": "sound-pack cue leading into the card (its lead_s pulls it earlier)" },
                "hit_cue": { "type": ["string", "null"], "default": "hit", "description": "sound-pack cue on the card's entrance" }
              }
            }
          }
        }
      }
    },
    "overlays": {
      "type": "object",
      "required": [
        "density"
      ],
      "additionalProperties": false,
      "properties": {
        "density": {
          "oneOf": [
            {
              "enum": [
                "low",
                "normal",
                "high"
              ]
            },
            {
              "type": "object",
              "required": [
                "per_minute"
              ],
              "additionalProperties": false,
              "properties": {
                "per_minute": {
                  "type": "number",
                  "minimum": 0
                }
              }
            }
          ]
        },
        "allowed_packs": {
          "type": "array",
          "items": {
            "type": "string"
          },
          "description": "component packs the planner may draw from \u2014 the menu filter AND the validate rule (belt and suspenders). Pack granularity, not per component: a channel resolves to `core` plus at most one installed pack (packs are additive), so this says which EXTRA packs a style suits. `core` is always in the menu and listing it here is redundant; omitting it does not remove it. Omitted means every pack. Per-component trimming is the channel's job, via look.exclude.components."
        },
        "emphasis": {
          "type": "object",
          "additionalProperties": false,
          "description": "D59 \u2014 a SECOND overlay class, keyed on where attention needs a lift rather than on a fact in the script. Off by default: `density` above is anchor-gated, so it tracks factual density, which is right for a documentary and limiting for a faster channel. The two classes are counted under separate budgets, so turning this on cannot dilute the first.",
          "properties": {
            "enabled": {
              "type": "boolean",
              "default": false
            },
            "per_minute": {
              "type": "number",
              "minimum": 0,
              "default": 1,
              "description": "ceiling for emphasis overlays alone, per minute of narration"
            }
          }
        }
      }
    },
    "transitions": {
      "type": "object",
      "required": [
        "allowed",
        "default"
      ],
      "additionalProperties": false,
      "properties": {
        "duration_s": {
          "type": "number",
          "exclusiveMinimum": 0,
          "maximum": 2,
          "description": "D89 — how long a non-cut transition runs. The PACK owns this, not the beat: a transition eats footage from the shots on both sides of it, so its length is a property of the style's pacing, not of one junction. Omitted means 0.5s, which is what every transition was before. The compiler clamps it against both neighbours and degrades to a cut when a beat is too short to give it room."
        },
        "allowed": {
          "type": "array",
          "minItems": 1,
          "items": {
            "enum": [
              "cut",
              "crossfade",
              "fade",
              "fade_to_black",
              "whip",
              "zoom_through",
              "push",
              "wipe",
              "flash"
            ]
          }
        },
        "default": {
          "enum": [
            "cut",
            "crossfade",
            "fade",
            "fade_to_black",
            "whip",
            "zoom_through",
            "push",
            "wipe",
            "flash"
          ]
        },
        "animated_share": {
          "type": "number",
          "minimum": 0,
          "maximum": 0.6,
          "description": "D95 — the target share of junctions that are NOT a cut, e.g. 0.3 for a 70/30 mix. The compiler places them: section breaks first, then FILLER from `mix`, spread evenly, never two animated junctions side by side. A target, not a promise: a junction whose shots are too short to hold the transition stays a cut, so a fast pack delivers less than it asks (the compile note says how much). Omitted means no filler — every junction is the default, as before. Capped at 0.6 because past that a mix stops being a mix. Requires `mix`."
        },
        "mix": {
          "type": "object",
          "minProperties": 1,
          "description": "D95 — which kinds FILLER draws from, as relative weights ({\"crossfade\": 2, \"fade_to_black\": 1} is two crossfades per dip). Each kind must be in `allowed`. The kind at a junction is picked from a hash of the shot's id, so a recompile of the same beats picks the same kinds. Read only when `animated_share` is set.",
          "propertyNames": { "enum": ["crossfade", "fade", "fade_to_black", "whip", "zoom_through", "push", "wipe", "flash"] },
          "additionalProperties": { "type": "number", "exclusiveMinimum": 0 }
        },
        "section_break": {
          "enum": ["crossfade", "fade", "fade_to_black", "whip", "zoom_through", "push", "wipe", "flash"],
          "description": "D95 — the transition where the story changes section. The signal is the MUSIC's: a section starts where the mood span changes (the same spans, and the same `music.min_span_s` floor, that switch the bed), so the picture turns where the score does and a one-beat mood blip is not a section. Must be in `allowed`. Counts toward `animated_share`. Omitted means section changes get no special treatment."
        },
        "durations": {
          "type": "object",
          "description": "D95 — per-kind length, overriding `duration_s` for that kind: a dip to black wants longer than a crossfade. Same clamping as `duration_s`.",
          "propertyNames": { "enum": ["crossfade", "fade", "fade_to_black", "whip", "zoom_through", "push", "wipe", "flash"] },
          "additionalProperties": { "type": "number", "exclusiveMinimum": 0, "maximum": 2 }
        },
        "per_component": {
          "type": "object",
          "description": "D95 slice 3 — the transition INTO the shot a given overlay opens on, by catalog component name: {\"ChapterCard\": \"wipe\"} makes every chapter card arrive on a wipe. Applies only when the overlay opens within 0.7 s after its shot starts — the compiler floors an overlay's start at 0.4 s into its beat — since an overlay that opens mid-shot has no cut to arrive on (the compile note says so). A beat's own transition_out still wins. Each kind must be in `allowed`. Counts toward `animated_share`. This is the SHOT transition; how the overlay itself animates in is the theme's `motion.per_component`.",
          "propertyNames": { "pattern": "^[A-Z][A-Za-z0-9]*$" },
          "additionalProperties": { "enum": ["crossfade", "fade", "fade_to_black", "whip", "zoom_through", "push", "wipe", "flash"] }
        }
      }
    },
    "script_persona": {
      "type": "string",
      "description": "persona/style text for the script agent"
    },
    "visual_language": {
      "type": "string",
      "description": "visual guidance text for the beat planner"
    },
    "script": {
      "type": "object",
      "additionalProperties": false,
      "description": "narration shape (D45): length lives with the pacing numbers it interacts with, and is overridable per video like overlays.density",
      "properties": {
        "target_seconds": {
          "type": "number",
          "exclusiveMinimum": 0,
          "description": "target seconds of speech; the script prompt receives it as {{target_seconds}}"
        },
        "tolerance": {
          "type": "number",
          "minimum": 0,
          "maximum": 1,
          "default": 0.25,
          "description": "accepted deviation, as a fraction of target_seconds"
        },
        "prompt": {
          "type": "string",
          "pattern": "^[a-z0-9][a-z0-9-]*$",
          "description": "prompt pack name carrying this pack's voice \u2014 layer 3 of the D44 resolution order"
        }
      }
    },
    "fallback": {
      "type": "object",
      "additionalProperties": false,
      "description": "D55 \u2014 what to put on screen when the sources have nothing good enough (source_policy.visual.min_score_floor). A card that names the subject is honest; a clip that is nearly unrelated is a lie the viewer notices and cannot name. Absent = keep the weak asset, since a beat with nothing on it is worse than a beat with the wrong thing on it.",
      "properties": {
        "component": {
          "type": "string",
          "description": "catalog component drawn over a plain colour fill; it must be one this pack's allowed_components list would accept"
        },
        "text_prop": {
          "type": "string",
          "default": "title",
          "description": "which prop takes the words, derived from the beat's own keyword query (v1.1) or its visual_intent"
        }
      }
    },
    "sfx": {
      "type": "object",
      "additionalProperties": false,
      "description": "D48 \u2014 how OFTEN sound effects fire. Numbers, enforced by the compiler and re-checked by the validator, exactly like overlays.density (D9). The theme picks which sound; this picks how many.",
      "properties": {
        "enabled": {
          "type": "boolean",
          "default": true
        },
        "cues": {
          "type": "array",
          "items": {
            "enum": [
              "entrance",
              "transition"
            ]
          },
          "default": [
            "entrance"
          ],
          "description": "which events may fire a cue at all. Transitions are opt-in on purpose."
        },
        "max_per_minute": {
          "type": "number",
          "minimum": 0,
          "default": 4,
          "description": "hard cap; the compiler drops the lowest-priority cues to stay under it"
        },
        "min_gap_s": {
          "type": "number",
          "minimum": 0,
          "default": 1.2,
          "description": "minimum spacing between two cue starts; on collision the higher-priority cue survives"
        }
      }
    },
    "music": {
      "type": "object",
      "additionalProperties": false,
      "description": "D48 \u2014 how background music is SHAPED across the video. Which bed comes from the theme's mood_beds; the mood itself comes from the beat sheet.",
      "properties": {
        "enabled": {
          "type": "boolean",
          "default": true
        },
        "min_span_s": {
          "type": "number",
          "exclusiveMinimum": 0,
          "default": 20,
          "description": "a mood run shorter than this merges into its neighbour. Without a floor, a two-beat mood blip restarts the bed and the score turns chatty."
        },
        "crossfade_s": {
          "type": "number",
          "minimum": 0,
          "default": 1.5,
          "description": "fade in/out at each span boundary; adjacent spans overlap by this much"
        }
      }
    }
  }
}
