{
  "name": "listicle-fast",
  "video_type": "listicle",
  "pacing": {
    "avg_hold_seconds": 2.2,
    "min_hold": 1.4,
    "max_hold": 4.5,
    "arc": "listicle",
    "hold_floor_ratio": 1.0,
    "hold_ceiling_ratio": 1.5
  },
  "overlays": {
    "density": "high",
    "allowed_packs": [
      "basic",
      "core",
      "social"
    ]
  },
  "transitions": {
    "allowed": [
      "cut",
      "crossfade",
      "fade_to_black",
      "whip",
      "push",
      "wipe"
    ],
    "default": "cut",
    "animated_share": 0.35,
    "mix": {
      "whip": 2,
      "push": 1
    },
    "section_break": "wipe",
    "durations": {
      "whip": 0.3,
      "push": 0.4
    }
  },
  "script_persona": "Upbeat countdown narrator. Each item opens with its rank and a hook.",
  "visual_language": "Punchy hero shots per item; consistent framing between items.",
  "sfx": {
    "enabled": true,
    "cues": [
      "entrance"
    ],
    "max_per_minute": 8,
    "min_gap_s": 0.9
  },
  "music": {
    "enabled": true,
    "min_span_s": 16,
    "crossfade_s": 1.2
  }
}
