{
  "name": "archive-doc",
  "video_type": "doc",
  "pacing": {
    "avg_hold_seconds": 4.5,
    "min_hold": 2.5,
    "max_hold": 9.0,
    "arc": "three_act",
    "hold_floor_ratio": 1.0,
    "hold_ceiling_ratio": 1.5
  },
  "overlays": {
    "density": "low",
    "allowed_packs": [
      "basic",
      "core"
    ]
  },
  "transitions": {
    "allowed": [
      "cut",
      "crossfade",
      "fade_to_black"
    ],
    "default": "cut",
    "animated_share": 0.15,
    "mix": {
      "crossfade": 1
    },
    "section_break": "fade_to_black",
    "durations": {
      "fade_to_black": 0.8
    }
  },
  "script_persona": "Grave, precise documentary narrator. Short sentences. Names, dates and sources stated plainly.",
  "visual_language": "Archival footage and stills, desaturated; the overlays are white plates and tan strips pinned over the picture.",
  "sfx": {
    "enabled": false
  },
  "music": {
    "enabled": true,
    "min_span_s": 28,
    "crossfade_s": 2.5
  }
}
