{
  "name": "explainer-medium",
  "video_type": "explainer",
  "pacing": {
    "avg_hold_seconds": 3.2,
    "min_hold": 2.0,
    "max_hold": 6.0,
    "arc": "three_act",
    "hold_floor_ratio": 1.0,
    "hold_ceiling_ratio": 1.5
  },
  "overlays": {
    "density": "normal",
    "allowed_packs": [
      "core"
    ]
  },
  "transitions": {
    "allowed": [
      "cut",
      "crossfade"
    ],
    "default": "cut"
  },
  "script_persona": "Clear, friendly explainer. Concrete examples. One idea per sentence.",
  "visual_language": "Clean, bright, illustrative footage; diagrams welcome; avoid clutter.",
  "sfx": {
    "enabled": true,
    "cues": [
      "entrance"
    ],
    "max_per_minute": 4,
    "min_gap_s": 1.2
  },
  "music": {
    "enabled": true,
    "min_span_s": 20,
    "crossfade_s": 1.5
  }
}
