{
  "name": "breakdown-blitz",
  "video_type": "breakdown",
  "pacing": {
    "avg_hold_seconds": 2.4,
    "min_hold": 1.4,
    "max_hold": 4.5,
    "arc": "linear",
    "hold_floor_ratio": 1.0,
    "hold_ceiling_ratio": 1.5
  },
  "overlays": {
    "density": {
      "per_minute": 9
    },
    "allowed_packs": [
      "basic",
      "core",
      "finance",
      "social"
    ]
  },
  "transitions": {
    "allowed": [
      "cut",
      "crossfade",
      "zoom_through",
      "whip",
      "flash"
    ],
    "default": "cut",
    "animated_share": 0.3,
    "mix": {
      "zoom_through": 2,
      "whip": 1
    },
    "section_break": "flash",
    "durations": {
      "whip": 0.3,
      "flash": 0.4
    }
  },
  "script_persona": "Rapid analyst. One idea per sentence, numbers up front, no wind-up. Every second earns the next.",
  "visual_language": "Tight close-ups, mechanisms and hands, hard cuts between scales; avoid slow establishing drone shots.",
  "sfx": {
    "enabled": true,
    "cues": [
      "entrance",
      "transition"
    ],
    "max_per_minute": 8,
    "min_gap_s": 0.9
  },
  "music": {
    "enabled": true,
    "min_span_s": 14,
    "crossfade_s": 1.0
  }
}
