{
  "name": "directed-test",
  "video_type": "doc",
  "pacing": {
    "avg_hold_seconds": 4.0,
    "min_hold": 2.0,
    "max_hold": 6.0,
    "arc": "linear",
    "hold_floor_ratio": 1.0,
    "hold_ceiling_ratio": 1.5
  },
  "overlays": {
    "density": {
      "per_minute": 60
    },
    "allowed_packs": [
      "basic"
    ],
    "emphasis": {
      "enabled": true,
      "per_minute": 60
    }
  },
  "transitions": {
    "allowed": [
      "cut",
      "crossfade"
    ],
    "default": "cut"
  },
  "script_persona": "Grave, measured. Third person. Short declarative sentences. Names, dates and places stated plainly. No excitement, no direct address.",
  "visual_language": "Cinematic stock footage of extreme landscapes and expedition activity, intercut with archival paintings and maps as exhibits with slow ken_burns; avoid modern urban footage, talking heads, and screen recordings.",
  "script": {
    "target_seconds": 90,
    "tolerance": 0.25,
    "prompt": "doc-grave"
  },
  "sfx": {
    "enabled": true,
    "cues": [
      "entrance"
    ],
    "max_per_minute": 6,
    "min_gap_s": 2.5
  },
  "music": {
    "enabled": true,
    "min_span_s": 25,
    "crossfade_s": 1.5
  }
}
